{
  "dynamic_ip_required": false,
  "tags": [
    "bull",
    "one",
    "two",
    "three"
  ],
  "commercial_type": "START1-L",
  "volumes": {
    "1": {
      "name": "Volume",
      "volume_type": "l_ssd",
      "size": 150000000000,
      "organization": "***REMOVED***"
    }
  },
  "organization": "***REMOVED***",
  "name": "scw-731052",
  "boot_type": "local",
  "image": "ca9a9340-92e8-4c5f-8ae1-423466f7ef30",
  "enable_ipv6": false
}